{
  "schema_version": 0,
  "mutation_id": "mut.bigger-buffer",
  "base_revision": "a1b2c3d4e5f6a7b8c9d0",
  "analysis": {
    "failure_paths": ["maintain-storage failed: haul steps stall on full stockpile"],
    "likely_paths": ["food buffer exhausted during a siege"]
  },
  "mutations": [
    {"op": "set", "path": "start.cooking.buffer", "value": 8},
    {"op": "upsert", "path": "govern.goals", "value": {"id": "overflow-stockpile", "effect": {}, "steps": []}}
  ],
  "rationale": "Bigger meal buffer absorbs haul stalls; overflow zone unblocks storage."
}
